{
  "schema_version": 1,
  "name": "V19 Express first-020 protocol-v1 public dev candidates",
  "source": {
    "root": "../../source",
    "commit": null,
    "digest": "242425838745939550a08a6d32610d40d8779f8f2699c48efbe87b19395c4134",
    "files": [
      "index.js",
      "lib/application.js",
      "lib/express.js",
      "lib/request.js",
      "lib/response.js",
      "lib/utils.js",
      "lib/view.js"
    ]
  },
  "queries": "queries.compat.dev.jsonl",
  "queries_digest": "7ddfbbdc02d2b7a06e49e7ebe6b3ac50d6003a9229753bd032064713cbffcd2b",
  "scoring": "oce-compat-v1",
  "repetitions": 3,
  "warmup": 0,
  "seed": 20261003,
  "timeout_ms": 30000,
  "top_k": 10,
  "engine_config": {
    "auto_index": {
      "enabled": false
    }
  }
}